{
    "title": "QAOA for MaxCut",
    "authors": [
        {
            "username": "alowe"
        }
    ],
    "executable_stable": true,
    "executable_latest": true,
    "dateOfPublication": "2019-10-11T00:00:00+00:00",
    "dateOfLastModification": "2026-04-06T00:00:00+00:00",
    "categories": [
        "Optimization"
    ],
    "tags": [],
    "previewImages": [
        {
            "type": "thumbnail",
            "uri": "/_static/demo_thumbnails/regular_demo_thumbnails/thumbnail_QAOA_for_MaxCut.png"
        }
    ],
    "seoDescription": "Implementing the quantum approximate optimization algorithm using PennyLane to solve the MaxCut problem.",
    "doi": "",
    "references": [],
    "basedOnPapers": [
        "10.48550/arXiv.1411.4028"
    ],
    "referencedByPapers": [],
    "relatedContent": [
        {
            "type": "demonstration",
            "id": "tutorial_qaoa_intro",
            "weight": 1.0
        }
    ],
    "discussionForumUrl": "https://discuss.pennylane.ai/t/qaoa-and-optimization/5188"
}
