{
    "title": "How to import noise models from Qiskit",
    "authors": [
        {
            "username": "whatsis"
        }
    ],
    "executable_stable": true,
    "executable_latest": true,
    "dateOfPublication": "2024-11-25T00:00:00+00:00",
    "dateOfLastModification": "2026-05-15T00:00:00+00:00",
    "categories": [
        "Quantum Computing",
        "How-to"
    ],
    "tags": [],
    "previewImages": [
        {
            "type": "thumbnail",
            "uri": "/_static/demo_thumbnails/regular_demo_thumbnails/thumbnail_how_to_import_qiskit_noise_models.png"
        },
        {
            "type": "large_thumbnail",
            "uri": "/_static/demo_thumbnails/large_demo_thumbnails/thumbnail_large_how_to_import_qiskit_noise_models.png"
        }
    ],
    "seoDescription": "Learn how noise models can be imported into PennyLane from Qiskit.",
    "doi": "",
    "references": [],
    "basedOnPapers": [],
    "referencedByPapers": [],
    "relatedContent": [
        {
            "type": "demonstration",
            "id": "tutorial_how_to_use_noise_models",
            "weight": 1.0
        },
        {
            "type": "demonstration",
            "id": "tutorial_noisy_circuits",
            "weight": 1.0
        }
    ]
}