{
    "title": "Modelling chemical reactions on a quantum computer",
    "authors": [
        {
            "username": "vrishi"
        },
        {
            "username": "ixfoduap"
        }
    ],
    "executable_stable": true,
    "executable_latest": true,
    "dateOfPublication": "2021-07-23T00:00:00+00:00",
    "dateOfLastModification": "2026-04-10T15:48:14+00:00",
    "categories": [
        "Quantum Chemistry"
    ],
    "tags": [],
    "previewImages": [
        {
            "type": "thumbnail",
            "uri": "/_static/demo_thumbnails/regular_demo_thumbnails/thumbnail_modelling_chemical_reactions_QC.png"
        }
    ],
    "seoDescription": "Construct potential energy surfaces for chemical reactions",
    "doi": "",
    "references": [
        {
            "id": "motta2020",
            "type": "article",
            "title": "A Tale of Colliding Electrons: Boosting the Accuracy of Chemical Simulations on Quantum Computers",
            "authors": "Mario Motta, Tanvi Gujarati, and Julia Rice",
            "year": "2020",
            "journal": "",
            "url": "https://medium.com/qiskit/a-tale-of-colliding-electrons-boosting-the-accuracy-of-chemical-simulations-on-quantum-computers-50a4b4ee5c64"
        }
    ],
    "basedOnPapers": [],
    "referencedByPapers": [],
    "relatedContent": [
        {
            "type": "demonstration",
            "id": "tutorial_quantum_chemistry",
            "weight": 1.0
        },
        {
            "type": "demonstration",
            "id": "tutorial_vqe",
            "weight": 1.0
        }
    ]
}
