{
    "title": "Using PennyLane and Qualtran to analyze how QSP can improve measurements of molecular properties",
    "authors": [
        {
            "username": "Diego"
        },
        {
            "username": "oumarou"
        },
        {
            "username": "ANT0N"
        },
        {
            "username": "austingmhuang"
        }
    ],
    "executable_stable": true,
    "executable_latest": true,
    "dateOfPublication": "2025-08-29T00:00:00+00:00",
    "dateOfLastModification": "2026-06-19T00:00:00+00:00",
    "categories": [
        "Quantum Computing",
        "Resource Estimation"
    ],
    "tags": [],
    "previewImages": [
        {
            "type": "thumbnail",
            "uri": "/_static/demo_thumbnails/regular_demo_thumbnails/pennylane-demo-qualtran-covestro-krylov-subspace-paper-thumbnail.png"
        },
        {
            "type": "large_thumbnail",
            "uri": "/_static/demo_thumbnails/large_demo_thumbnails/pennylane-demo-qualtran-covestro-krylov-subspace-paper-large-thumbnail.png"
        }
    ],
    "seoDescription": "Learn how to obtain reduced density matrices with QKSD and QSP",
    "doi": "",
    "references": [],
    "basedOnPapers": [
        "10.48550/arXiv.2501.05286"
    ],
    "referencedByPapers": [],
    "relatedContent": [
        {
            "type": "demonstration",
            "id": "tutorial_how_to_use_qualtran_with_pennylane",
            "weight": 1.0
        },
        {
            "type": "demonstration",
            "id": "function_fitting_qsp",
            "weight": 1.0
        },
        {
            "type": "demonstration",
            "id": "tutorial_intro_qsvt",
            "weight": 1.0
        }
    ]
}
