{
    "title": "Circuits as Fourier series",
    "authors": [
        {
            "username": "hapax"
        }
    ],
    "executable_stable": false,
    "executable_latest": false,
    "dateOfPublication": "2023-09-11T00:00:00+00:00",
    "dateOfLastModification": "2026-05-15T00:00:00+00:00",
    "categories": [
        "Optimization",
        "Quantum Machine Learning"
    ],
    "tags": [],
    "previewImages": [
        {
            "type": "thumbnail",
            "uri": "/_static/demonstration_assets/circuits_as_fourier_series/thumbnail_circuits_as_fourier_series.png"
        },
        {
            "type": "large_thumbnail",
            "uri": "/_static/demo_thumbnails/large_demo_thumbnails/thumbnail_large_circuits_as_fourier_series.png"
        }
    ],
    "seoDescription": "Learn with this interactive, code-free introduction to the idea of quantum circuits as Fourier series.",
    "doi": "",
    "references": [],
    "basedOnPapers": [],
    "referencedByPapers": [],
    "relatedContent": [
        {
            "type": "demonstration",
            "id": "tutorial_expressivity_fourier_series",
            "weight": 1.0
        },
        {
            "type": "demonstration",
            "id": "tutorial_general_parshift",
            "weight": 1.0
        },
        {
            "type": "demonstration",
            "id": "tutorial_stochastic_parameter_shift",
            "weight": 1.0
        }
    ]
}