{
    "title": "Here comes the SU(N): multivariate quantum gates and gradients",
    "authors": [
        {
            "username": "dwierichs"
        }
    ],
    "executable_stable": true,
    "executable_latest": true,
    "dateOfPublication": "2023-04-03T00:00:00+00:00",
    "dateOfLastModification": "2026-05-28T00:00:00+00:00",
    "categories": [
        "Optimization"
    ],
    "tags": [],
    "previewImages": [
        {
            "type": "thumbnail",
            "uri": "/_static/demonstration_assets/here_comes_the_sun/thumbnail_tutorial_here_comes_the_sun.png"
        },
        {
            "type": "large_thumbnail",
            "uri": "/_static/demo_thumbnails/large_demo_thumbnails/thumbnail_large_here_comes_the_sun.png"
        }
    ],
    "seoDescription": "Learn about multivariate quantum gates for optimization",
    "doi": "",
    "references": [
        {
            "id": "vatan",
            "type": "article",
            "title": "Optimal Quantum Circuits for General Two-Qubit Gates",
            "authors": "Farrokh Vatan and Colin Williams",
            "year": "2003",
            "publisher": "",
            "journal": "",
            "url": "https://arxiv.org/abs/quant-ph/0308006"
        },
        {
            "id": "wiersema",
            "type": "article",
            "title": "Here comes the SU(N): multivariate quantum gates and gradients",
            "authors": "R. Wiersema, D. Lewis, D. Wierichs, J. F. Carrasquilla, and N. Killoran",
            "year": "2023",
            "publisher": "",
            "journal": "",
            "url": "https://arxiv.org/abs/2303.11355"
        },
        {
            "id": "banchi",
            "type": "article",
            "title": "Measuring Analytic Gradients of General Quantum Evolution with the Stochastic Parameter Shift Rule.",
            "authors": "Leonardo Banchi and Gavin E. Crooks",
            "year": "2021",
            "publisher": "",
            "journal": "Quantum",
            "url": "https://quantum-journal.org/papers/q-2021-01-25-386/"
        }
    ],
    "basedOnPapers": [],
    "referencedByPapers": [],
    "relatedContent": [
        {
            "type": "demonstration",
            "id": "tutorial_vqe",
            "weight": 1.0
        },
        {
            "type": "demonstration",
            "id": "tutorial_general_parshift",
            "weight": 1.0
        },
        {
            "type": "demonstration",
            "id": "tutorial_unitary_designs",
            "weight": 1.0
        }
    ]
}