{
    "title": "Intro to QAOA",
    "authors": [
        {
            "username": "jceroni"
        }
    ],
    "executable_stable": false,
    "executable_latest": false,
    "dateOfPublication": "2020-11-18T00:00:00+00:00",
    "dateOfLastModification": "2026-10-23T00:00:00+00:00",
    "categories": [
        "Optimization",
        "Getting Started"
    ],
    "tags": [],
    "previewImages": [
        {
            "type": "thumbnail",
            "uri": "/_static/demo_thumbnails/regular_demo_thumbnails/thumbnail_intro_to_QAOA.png"
        }
    ],
    "seoDescription": "Learn how to implement QAOA with PennyLane",
    "doi": "",
    "references": [],
    "basedOnPapers": [],
    "referencedByPapers": [],
    "relatedContent": [
        {
            "type": "demonstration",
            "id": "tutorial_qaoa_maxcut",
            "weight": 1.0
        }
    ],
    "hardware": [
        {
            "id": "qbraid",
            "link": "https://account.qbraid.com?gitHubUrl=https://github.com/PennyLaneAI/pennylane-demo-notebooks.git",
            "logo": "/_static/hardware_logos/qbraid.png"
        }
    ],
    "discussionForumUrl": "https://discuss.pennylane.ai/t/qaoa-and-optimization/5188"
}