{
    "title": "Data-reuploading classifier",
    "authors": [
        {
            "username": "quantshah"
        }
    ],
    "executable_stable": true,
    "executable_latest": true,
    "dateOfPublication": "2019-10-11T00:00:00+00:00",
    "dateOfLastModification": "2026-06-19T15:48:14+00:00",
    "categories": [
        "Quantum Machine Learning"
    ],
    "tags": [],
    "previewImages": [
        {
            "type": "thumbnail",
            "uri": "/_static/demo_thumbnails/regular_demo_thumbnails/thumbnail_data-reuploading_classified.png"
        }
    ],
    "seoDescription": "Implement a single-qubit universal quantum classifier using PennyLane.",
    "doi": "",
    "references": [
        {
            "id": "PerezSalinas2019",
            "type": "article",
            "title": "Data re-uploading for a universal quantum classifier",
            "authors": "Pérez-Salinas, Adrián, et al.",
            "year": "2019",
            "journal": "",
            "url": ""
        },
        {
            "id": "Kingma2014",
            "type": "article",
            "title": "Adam: A method for stochastic optimization",
            "authors": "Kingma, Diederik P., and Ba, J.",
            "year": "2014",
            "journal": "",
            "url": ""
        },
        {
            "id": "Liu1989",
            "type": "article",
            "title": "On the limited memory BFGS method for large scale optimization.",
            "authors": "Liu, Dong C., and Nocedal, J.",
            "year": "1989",
            "journal": "Mathematical programming",
            "url": ""
        }
    ],
    "basedOnPapers": [
        "10.48550/arXiv.1907.02085"
    ],
    "referencedByPapers": [],
    "relatedContent": [
        {
            "type": "demonstration",
            "id": "tutorial_variational_classifier",
            "weight": 1.0
        },
        {
            "type": "demonstration",
            "id": "tutorial_multiclass_classification",
            "weight": 1.0
        },
        {
            "type": "demonstration",
            "id": "tutorial_expressivity_fourier_series",
            "weight": 1.0
        }
    ]
}