{
  "title": "Simulating Vibronic Dynamics",
  "authors": [
    {
      "username": "emgem"
    }
  ],
  "executable_stable": true,
  "executable_latest": true,
  "dateOfPublication": "2026-06-10T00:00:00+00:00",
  "dateOfLastModification": "2026-06-10T00:00:00+00:00",
  "categories": ["Algorithms"],
  "tags": ["Vibronics", "Simulating", "Trotter", "Algorithm"],
  "previewImages": [
    {
      "type": "thumbnail",
      "uri": "/_static/demo_thumbnails/pennylane-demo-simulating-vibronic-dynamics-thumbnail.png"
    },
    {
      "type": "large_thumbnail",
      "uri": "/_static/demo_thumbnails/pennylane-demo-simulating-vibronic-dynamics-large-thumbnail.png"
    }
  ],
  "seoDescription": "A lot of interesting science occurs when systems become dynamic. Quantum computing shows promise to address the limitations faced by classical computers in dynamic simulations.",
  "doi": "",
  "references": [
     {
      "id": "Motlagh2025",
      "type": "article",
      "title": "Quantum Algorithms for Vibronic Dynamics: Case Study on Singlet Fission Solar Cell Design",
      "authors": "Motlagh, Lang, Jain, Aspuru-Guzik, and Arrazola",
      "year": "2025",
      "doi": "10.48550/arXiv.2411.13669",
      "url": "https://doi.org/10.48550/arXiv.2411.13669"
    },
    {
      "id": "Lang2026",
      "type": "article",
      "title": "Quantum Algorithm for Simulating Non-Adiabatic Dynamics at Metallic Surfaces",
      "authors": "Lang, Jain, Arrazola, and Motlagh",
      "year": "2026",
      "doi": "10.48550/arXiv.2601.16264",
      "url": "https://doi.org/10.48550/arXiv.2601.16264"
    }
  ],
  "basedOnPapers": [
    "10.48550/arXiv.2411.13669"
  ],
  "referencedByPapers": [],
  "relatedContent": [
    {
      "type":"demonstration",
      "id": "exploring_trotterization",
      "weight": 1.0
    },
    {
      "type":"demonstration",
      "id": "tutorial_resource_estimation_vibronic_dynamics",
      "weight": 1.0
    },
    {
      "type":"demonstration",
      "id": "tutorial_intro_qrom",
      "weight": 1.0
    }
  ]
}