{
    "title": "How to simulate quantum circuits with tensor networks using DefaultTensor",
    "authors": [
        {
            "username": "Frisus95"
        }
    ],
    "executable_stable": true,
    "executable_latest": true,
    "dateOfPublication": "2024-07-09T00:00:00+00:00",
    "dateOfLastModification": "2026-04-14T15:48:14+00:00",
    "categories": [
        "Getting Started",
        "Quantum Computing",
        "Devices and Performance",
        "How-to"
    ],
    "tags": [
        "how to"
    ],
    "previewImages": [
        {
            "type": "thumbnail",
            "uri": "/_static/demo_thumbnails/regular_demo_thumbnails/thumbnail_how_to_default_tensor.png"
        },
        {
            "type": "large_thumbnail",
            "uri": "/_static/demo_thumbnails/large_demo_thumbnails/thumbnail_large_how_to_default_tensor.png"
        }
    ],
    "seoDescription": "Learn how to simulate quantum circuits with tensor networks using the default.tensor PennyLane device.",
    "doi": "",
    "references": [
        {
            "id": "orus",
            "type": "article",
            "title": "A practical introduction to tensor networks: Matrix product states and projected entangled pair states",
            "authors": "R. Orús",
            "year": "2014",
            "journal": "Annals of Physics",
            "url": "https://www.sciencedirect.com/science/article/pii/S0003491614001596"
        }
    ],
    "basedOnPapers": [],
    "referencedByPapers": [],
    "relatedContent": [
        {
            "type": "demonstration",
            "id": "tutorial_tn_circuits",
            "weight": 1.0
        }
    ]
}