{
    "title": "Quadratic unconstrained binary optimization",
    "authors": [
        {
            "username": "alejomonbar"
        }
    ],
    "executable_stable": false,
    "executable_latest": false,
    "dateOfPublication": "2024-02-29T00:00:00+00:00",
    "dateOfLastModification": "2026-10-19T00:00:00+00:00",
    "categories": [
        "Optimization"
    ],
    "tags": [],
    "previewImages": [
        {
            "type": "thumbnail",
            "uri": "/_static/demonstration_assets/QUBO/thumbnail_QUBO_2024-02-06.png"
        },
        {
            "type": "large_thumbnail",
            "uri": "/_static/demo_thumbnails/large_demo_thumbnails/thumbnail_large_QuBO_2024-02-06.png"
        }
    ],
    "seoDescription": "Learn how to solve a QUBO problem in a quantum computer.",
    "doi": "",
    "references": [],
    "basedOnPapers": [],
    "referencedByPapers": [],
    "relatedContent": [],
    "discussionForumUrl": "https://discuss.pennylane.ai/t/quadratic-unconstrained-binary-optimization-qubo-demo/7339"
}