{
    "title": "Accelerating VQEs with quantum natural gradient",
    "authors": [
        {
            "username": "mli"
        },
        {
            "username": "lbozanic"
        },
        {
            "username": "ssim"
        }
    ],
    "executable_stable": true,
    "executable_latest": true,
    "dateOfPublication": "2020-11-06T00:00:00+00:00",
    "dateOfLastModification": "2026-05-28T00:00:00+00:00",
    "categories": [
        "Optimization"
    ],
    "tags": [],
    "previewImages": [
        {
            "type": "thumbnail",
            "uri": "/_static/demo_thumbnails/regular_demo_thumbnails/thumbnail_accelerating_VQEs.png"
        }
    ],
    "seoDescription": "Accelerating variational quantum eigensolvers using quantum natural gradients in PennyLane.",
    "doi": "",
    "references": [
        {
            "id": "stokes2019",
            "type": "article",
            "title": "Quantum Natural Gradient",
            "authors": "Stokes, James, et al.",
            "year": "2019",
            "journal": "",
            "url": "https://arxiv.org/abs/1909.02108"
        },
        {
            "id": "yamamoto2019",
            "type": "article",
            "title": "On the natural gradient for variational quantum eigensolver",
            "authors": "Yamamoto, Naoki",
            "year": "2019",
            "journal": "",
            "url": "https://arxiv.org/abs/1909.05074"
        },
        {
            "id": "peruzzo2014",
            "type": "article",
            "title": "A variational eigenvalue solver on a photonic quantum processor",
            "authors": "Alberto Peruzzo, Jarrod McClean et al.",
            "year": "2014",
            "journal": "Nature Communications",
            "url": "https://www.nature.com/articles/ncomms5213?origin=ppub"
        }
    ],
    "basedOnPapers": [],
    "referencedByPapers": [],
    "relatedContent": [
        {
            "type": "demonstration",
            "id": "tutorial_vqe",
            "weight": 1.0
        },
        {
            "type": "demonstration",
            "id": "tutorial_quantum_natural_gradient",
            "weight": 1.0
        }
    ]
}