{
    "title": "Variational quantum linear solver",
    "authors": [
        {
            "username": "amari"
        }
    ],
    "executable_stable": true,
    "executable_latest": true,
    "dateOfPublication": "2019-11-04T00:00:00+00:00",
    "dateOfLastModification": "2026-10-19T00:00:00+00:00",
    "categories": [
        "Optimization"
    ],
    "tags": [],
    "previewImages": [
        {
            "type": "thumbnail",
            "uri": "/_static/demo_thumbnails/regular_demo_thumbnails/thumbnail_variationally_quantum_linear_solver.png"
        }
    ],
    "seoDescription": "Implementing the variational quantum linear solver to solve a system of linear equation with a quantum device.",
    "doi": "",
    "references": [
        {
            "id": "BravoPrieto2019",
            "type": "article",
            "title": "Variational Quantum Linear Solver: A Hybrid Algorithm for Linear Systems.",
            "authors": "Carlos Bravo-Prieto, Ryan LaRose, Marco Cerezo, Yigit Subasi, Lukasz Cincio, Patrick J. Coles",
            "year": "2019",
            "journal": "",
            "doi": "10.48550/arXiv.1909.05820",
            "url": "https://arxiv.org/abs/1909.05820"
        }
    ],
    "basedOnPapers": [
        "10.48550/arXiv.1909.05820"
    ],
    "referencedByPapers": [],
    "relatedContent": [
        {
            "type": "demonstration",
            "id": "tutorial_coherent_vqls",
            "weight": 1.0
        }
    ]
}