{
    "title": "Coherent Variational Quantum Linear Solver",
    "authors": [
        {
            "username": "amari"
        }
    ],
    "executable_stable": true,
    "executable_latest": true,
    "dateOfPublication": "2019-11-06T00:00:00+00:00",
    "dateOfLastModification": "2026-06-19T00:00:00+00:00",
    "categories": [
        "Optimization"
    ],
    "tags": [],
    "previewImages": [
        {
            "type": "thumbnail",
            "uri": "/_static/demo_thumbnails/regular_demo_thumbnails/thumbnail_coherent_variational_quantum_learner_solver.png"
        }
    ],
    "seoDescription": "This demonstration extends the variational quantum linear solver to solve linear equations defined by a probabilistic coherent operation.",
    "doi": "",
    "references": [
        {
            "id": "BravoPrieto2019",
            "type": "article",
            "title": "Variational Quantum Linear Solver: A Hybrid Algorithm for Linear Systems",
            "authors": "Carlos Bravo-Prieto, Ryan LaRose, Marco Cerezo, Yigit Subasi, Lukasz Cincio, Patrick J. Coles",
            "year": "2019",
            "journal": "",
            "url": "https://arxiv.org/abs/1909.05820"
        },
        {
            "id": "Kothari2014",
            "type": "phdthesis",
            "title": "Efficient algorithms in quantum query complexity",
            "authors": "Robin Kothari",
            "year": "2014",
            "journal": "",
            "url": ""
        }
    ],
    "basedOnPapers": [],
    "referencedByPapers": [],
    "relatedContent": [
        {
            "type": "demonstration",
            "id": "tutorial_vqls",
            "weight": 1.0
        }
    ]
}