{
    "title": "A game of surface codes: Large-scale quantum computing with lattice surgery",
    "authors": [
        {
            "username": "Qottmann"
        }
    ],
    "executable_stable": true,
    "executable_latest": true,
    "dateOfPublication": "2025-06-02T00:00:00+00:00",
    "dateOfLastModification": "2026-10-19T00:00:00+00:00",
    "categories": [
        "Quantum Computing",
        "Compilation",
        "Algorithms",
        "FTQC"
    ],
    "tags": [],
    "previewImages": [
        {
            "type": "thumbnail",
            "uri": "/_static/demo_thumbnails/regular_demo_thumbnails/thumbnail_game_of_surface_codes.png"
        },
        {
            "type": "large_thumbnail",
            "uri": "/_static/demo_thumbnails/large_demo_thumbnails/thumbnail_large_game_of_surface_codes.png"
        }
    ],
    "seoDescription": "A game of surface codes: Exploring space-time tradeoffs in surface code based quantum computation.",
    "doi": "",
    "references": [
        {
            "id": "Litinski",
            "type": "preprint",
            "title": "A Game of Surface Codes: Large-Scale Quantum Computing with Lattice Surgery",
            "authors": "Daniel Litinski",
            "year": "2021",
            "publisher": "",
            "journal": "",
            "doi": "10.22331/q-2019-03-05-128",
            "url": "https://arxiv.org/abs/1808.02892"
        }
    ],
    "basedOnPapers": [
        "10.22331/q-2019-03-05-128"
    ],
    "referencedByPapers": [],
    "relatedContent": [
        {
            "type": "demonstration",
            "id": "tutorial_toric_code",
            "weight": 1.0
        },
        {
            "type": "demonstration",
            "id": "tutorial_mbqc",
            "weight": 1.0
        }
    ]
}
