{
    "title": "QJIT compilation with Qrack and Catalyst",
    "authors": [
        {
            "username": "dstrano"
        }
    ],
    "executable_stable": false,
    "executable_latest": true,
    "dateOfPublication": "2024-07-10T00:00:00+00:00",
    "dateOfLastModification": "2026-05-25T00:00:00+00:00",
    "categories": [
        "Compilation",
        "Devices and Performance"
    ],
    "tags": [],
    "previewImages": [
        {
            "type": "thumbnail",
            "uri": "/_static/demo_thumbnails/regular_demo_thumbnails/thumbnail_qrack_catalyst_integration.png"
        },
        {
            "type": "large_thumbnail",
            "uri": "/_static/demo_thumbnails/large_demo_thumbnails/thumbnail_large_qrack_catalyst_integration.png"
        }
    ],
    "seoDescription": "Quantum JIT compilation (QJIT) using the Qrack device for PennyLane and Catalyst, with GPU-acceleration and novel optimization.",
    "doi": "",
    "references": [
        {
            "id": "QECReport",
            "type": "preprint",
            "title": "Exact and approximate simulation of large quantum circuits on a single GPU",
            "authors": "Daniel Strano, Benn Bollay, Aryan Blaauw, Nathan Shammah, William J. Zeng, Andrea Mari",
            "year": "2023",
            "publisher": "",
            "journal": "",
            "doi": "10.48550/arXiv.2304.14969",
            "url": "https://arxiv.org/abs/2304.14969"
        },
        {
            "id": "Wille",
            "type": "preprint",
            "title": "Decision Diagrams for Quantum Computing",
            "authors": "Robert Wille, Stefan Hillmich, Lukas Burgholzer",
            "year": "2023",
            "publisher": "",
            "journal": "",
            "doi": "10.48550/arXiv.2302.04687",
            "url": "https://arxiv.org/abs/2302.04687"
        }
    ],
    "basedOnPapers": [],
    "referencedByPapers": [],
    "relatedContent": [
        {
            "type": "demonstration",
            "id": "tutorial_qft",
            "weight": 1.0
        },
        {
            "type": "demonstration",
            "id": "tutorial_clifford_circuit_simulations",
            "weight": 1.0
        },
        {
            "type": "demonstration",
            "id": "tutorial_mcm_introduction",
            "weight": 1.0
        }
    ]
}
